
    =========================== USB Port1 ===========================

Connection Status        : 0x01 (Device is connected)
Port Chain               : 3-3-1-1-1
Properties               : 0x01
 IsUserConnectable       : yes
 PortIsDebugCapable      : no
 PortHasMultiCompanions  : no
 PortConnectorIsTypeC    : no
ConnectionIndex          : 0x01 (Port 1)
CompanionIndex           : 0
 CompanionHubSymLnk      : USB#VID_2109&PID_0822#8&3490c1eb&0&1#{f18a0e88-c30c-11d0-8815-00a0c906bed8}
 CompanionPortNumber     : 0x01 (Port 1)
 -> CompanionPortChain   : 3-7-1-1-1

      ========================== Summary =========================
Vendor ID                : 0x1A86 (Nanjing Qinheng Microelectronics Co., Ltd.)
Product ID               : 0xE008
Manufacturer String      : *ERROR* iManufacturer=1 but String Descriptor not found
Product String           : *ERROR* iProduct=2 but String Descriptor not found
Serial                   : ---
USB Version              : 1.0 (12 Mbit/s FullSpeed)
Port maximum Speed       : High-Speed (Companion Port 3-7-1-1-1 is doing the SuperSpeed)
Device maximum Speed     : Full-Speed
Device Connection Speed  : Full-Speed
Self powered             : no
Demanded Current         : 100 mA
Used Endpoints           : 3

      ======================== USB Device ========================

        +++++++++++++++++ Device Information ++++++++++++++++++
Device Description       : USB-Eingabegerät
Device Path              : \\?\USB#VID_1A86&PID_E008#9&3a4c5a79&0&1#{a5dcbf10-6530-11d2-901f-00c04fb951ed} (GUID_DEVINTERFACE_USB_DEVICE)
Kernel Name              : \Device\USBPDO-24
Device ID                : USB\VID_1A86&PID_E008\9&3A4C5A79&0&1
Hardware IDs             : USB\VID_1A86&PID_E008&REV_1400 USB\VID_1A86&PID_E008
Driver KeyName           : {745a17a0-74d3-11d0-b6fe-00a0c90f57da}\0016 (GUID_DEVCLASS_HIDCLASS)
Driver                   : \SystemRoot\System32\drivers\hidusb.sys (Version: 10.0.26100.5074  Date: 2025-08-30  Company: Microsoft Corporation)
Driver Inf               : C:\WINDOWS\inf\input.inf
Legacy BusType           : PNPBus
Class                    : HIDClass
Class GUID               : {745a17a0-74d3-11d0-b6fe-00a0c90f57da} (GUID_DEVCLASS_HIDCLASS)
Service                  : HidUsb
Enumerator               : USB
Location Info            : Port_#0001.Hub_#0018
Address                  : 1
Location IDs             : PCIROOT(0)#PCI(1C06)#PCI(0000)#USBROOT(0)#USB(3)#USB(1)#USB(1)#USB(1), ACPI(_SB_)#ACPI(PCI0)#ACPI(RP07)#ACPI(PXSX)#USBROOT(0)#USB(3)#USB(1)#USB(1)#USB(1)
Container ID             : {42d96191-8e4d-11f0-8248-0015833d0a57}
Manufacturer Info        : (Standardsystemgeräte)
Capabilities             : 0x84 (Removable, SurpriseRemovalOK)
Status                   : 0x0180600A (DN_DRIVER_LOADED, DN_STARTED, DN_DISABLEABLE, DN_REMOVABLE, DN_NT_ENUMERATOR, DN_NT_DRIVER)
First Install Date       : 2025-09-10 16:11:20
Last Arrival Date        : 2025-09-12 00:23:13
Bus Relations            : HID\VID_1A86&PID_E008\a&27b74a78&0&0000
SelectiveSuspendEnabled  : 0
EnhancedPowerMgmtEnabled : 1
Power State              : D0 (supported: D0, D3, wake from D0)

        ---------------- Connection Information ---------------
Connection Index         : 0x01 (Port 1)
Connection Status        : 0x01 (DeviceConnected)
Current Config Value     : 0x01 (Configuration 1)
Device Address           : 0x0E (14)
Is Hub                   : 0x00 (no)
Device Bus Speed         : 0x01 (Full-Speed)
Number of open Pipes     : 0x02 (2 pipes to data endpoints)
Pipe[0]                  : EndpointID=2  Direction=IN   ScheduleOffset=0  Type=Interrupt  wMaxPacketSize=0x8     bInterval=5   -> 196 Bits/ms = 24500 Bytes/s
Pipe[1]                  : EndpointID=2  Direction=OUT  ScheduleOffset=0  Type=Interrupt  wMaxPacketSize=0x8     bInterval=5   -> 196 Bits/ms = 24500 Bytes/s
Data (HexDump)           : 01 00 00 00 12 01 00 01 00 00 00 08 86 1A 08 E0   ................
                           00 14 01 02 00 01 01 01 00 0E 00 02 00 00 00 01   ................
                           00 00 00 07 05 82 03 08 00 05 00 00 00 00 07 05   ................
                           02 03 08 00 05 00 00 00 00                        .........

        --------------- Connection Information V2 -------------
Connection Index         : 0x01 (1)
Length                   : 0x10 (16 bytes)
SupportedUsbProtocols    : 0x03
 Usb110                  : 1 (yes, port supports USB 1.1)
 Usb200                  : 1 (yes, port supports USB 2.0)
 Usb300                  : 0 (no, port not supports USB 3.0) -> but Companion Port 3-7-1-1-1 does
 ReservedMBZ             : 0x00
Flags                    : 0x00
 DevIsOpAtSsOrHigher     : 0 (Device is not operating at SuperSpeed or higher)
 DevIsSsCapOrHigher      : 0 (Device is not SuperSpeed capable or higher)
 DevIsOpAtSsPlusOrHigher : 0 (Device is not operating at SuperSpeedPlus or higher)
 DevIsSsPlusCapOrHigher  : 0 (Device is not SuperSpeedPlus capable or higher)
 ReservedMBZ             : 0x00
Data (HexDump)           : 01 00 00 00 10 00 00 00 03 00 00 00 00 00 00 00   ................

    ---------------------- Device Descriptor ----------------------
bLength                  : 0x12 (18 bytes)
bDescriptorType          : 0x01 (Device Descriptor)
bcdUSB                   : 0x100 (USB Version 1.0)
bDeviceClass             : 0x00 (defined by the interface descriptors)
bDeviceSubClass          : 0x00
bDeviceProtocol          : 0x00
bMaxPacketSize0          : 0x08 (8 bytes)
idVendor                 : 0x1A86 (Nanjing Qinheng Microelectronics Co., Ltd.)
idProduct                : 0xE008
bcdDevice                : 0x1400
iManufacturer            : 0x01 (String Descriptor 1)
 Language 0x0409         : "WCH.CN ·"
iProduct                 : 0x02 (String Descriptor 2)
 Language 0x0409         : "USB to Serial"
iSerialNumber            : 0x00 (No String Descriptor)
bNumConfigurations       : 0x01 (1 Configuration)
Data (HexDump)           : 12 01 00 01 00 00 00 08 86 1A 08 E0 00 14 01 02   ................
                           00 01                                             ..

    ------------------ Configuration Descriptor -------------------
bLength                  : 0x09 (9 bytes)
bDescriptorType          : 0x02 (Configuration Descriptor)
wTotalLength             : 0x0029 (41 bytes)
bNumInterfaces           : 0x01 (1 Interface)
bConfigurationValue      : 0x01 (Configuration 1)
iConfiguration           : 0x04 (String Descriptor 4)
 *!*ERROR  String descriptor not found
bmAttributes             : 0x80
 D7: Bus Powered         : 0x01 (yes)
 D6: Self Powered        : 0x00 (no)
 D5: Remote Wakeup       : 0x00 (no)
 D4..0: Reserved, set 0  : 0x00
MaxPower                 : 0x32 (100 mA)
Data (HexDump)           : 09 02 29 00 01 01 04 80 32 09 04 00 00 02 03 00   ..).....2.......
                           00 00 09 21 00 01 00 01 22 25 00 07 05 82 03 08   ...!...."%......
                           00 05 07 05 02 03 08 00 05                        .........

        ---------------- Interface Descriptor -----------------
bLength                  : 0x09 (9 bytes)
bDescriptorType          : 0x04 (Interface Descriptor)
bInterfaceNumber         : 0x00 (Interface 0)
bAlternateSetting        : 0x00
bNumEndpoints            : 0x02 (2 Endpoints)
bInterfaceClass          : 0x03 (HID - Human Interface Device)
bInterfaceSubClass       : 0x00 (None)
bInterfaceProtocol       : 0x00 (None)
iInterface               : 0x00 (No String Descriptor)
Data (HexDump)           : 09 04 00 00 02 03 00 00 00                        .........

        ------------------- HID Descriptor --------------------
bLength                  : 0x09 (9 bytes)
bDescriptorType          : 0x21 (HID Descriptor)
bcdHID                   : 0x0100 (HID Version 1.00)
bCountryCode             : 0x00 (00 = not localized)
bNumDescriptors          : 0x01
Data (HexDump)           : 09 21 00 01 00 01 22 25 00                        .!...."%.
Descriptor 1:
bDescriptorType          : 0x22 (Class=Report)
wDescriptorLength        : 0x0025 (37 bytes)
  06 A0 FF          Usage Page (Vendor Defined)
  09 01             Usage (unk)
  A1 01             Collection (Application)
  09 01               Usage (unk)
  15 00               Logical Minimum (0)
  26 FF 00            Logical Maximum (255)
  75 08               Report Size (8)
  95 08               Report Count (8)
  81 02               Input (Var)
  09 02               Usage (unk)
  75 08               Report Size (8)
  95 08               Report Count (8)
  91 02               Output (Var)
  09 03               Usage (unk)
  75 08               Report Size (8)
  95 05               Report Count (5)
  B1 02               Feature (Var)
  C0                End Collection
Data (HexDump)           : 06 A0 FF 09 01 A1 01 09 01 15 00 26 FF 00 75 08   ...........&..u.
                           95 08 81 02 09 02 75 08 95 08 91 02 09 03 75 08   ......u.......u.
                           95 05 B1 02 C0                                    .....

        ----------------- Endpoint Descriptor -----------------
bLength                  : 0x07 (7 bytes)
bDescriptorType          : 0x05 (Endpoint Descriptor)
bEndpointAddress         : 0x82 (Direction=IN EndpointID=2)
bmAttributes             : 0x03 (TransferType=Interrupt)
wMaxPacketSize           : 0x0008 (8 bytes)
bInterval                : 0x05 (5 ms)
Data (HexDump)           : 07 05 82 03 08 00 05                              .......

        ----------------- Endpoint Descriptor -----------------
bLength                  : 0x07 (7 bytes)
bDescriptorType          : 0x05 (Endpoint Descriptor)
bEndpointAddress         : 0x02 (Direction=OUT EndpointID=2)
bmAttributes             : 0x03 (TransferType=Interrupt)
wMaxPacketSize           : 0x0008 (8 bytes)
bInterval                : 0x05 (5 ms)
Data (HexDump)           : 07 05 02 03 08 00 05                              .......

      -------------------- String Descriptors -------------------
             ------ String Descriptor 0 ------
bLength                  : 0x04 (4 bytes)
bDescriptorType          : 0x03 (String Descriptor)
Language ID[0]           : 0x0409 (English - United States)
Data (HexDump)           : 04 03 09 04                                       ....
             ------ String Descriptor 1 ------
bLength                  : 0x12 (18 bytes)
bDescriptorType          : 0x03 (String Descriptor)
Language 0x0409          : "WCH.CN ·"  *!*CAUTION  contains character below 0x20
Data (HexDump)           : 12 03 57 00 43 00 48 00 2E 00 43 00 4E 00 20 00   ..W.C.H...C.N. .
                           14 00                                             ..
             ------ String Descriptor 2 ------
bLength                  : 0x1C (28 bytes)
bDescriptorType          : 0x03 (String Descriptor)
Language 0x0409          : "USB to Serial"
Data (HexDump)           : 1C 03 55 00 53 00 42 00 20 00 74 00 6F 00 20 00   ..U.S.B. .t.o. .
                           53 00 65 00 72 00 69 00 61 00 6C 00               S.e.r.i.a.l.

        +++++++++++++++++ Device Information ++++++++++++++++++
Device Description       : HID-konformes, vom Hersteller definiertes Gerät
Device Path              : \\?\HID#VID_1A86&PID_E008#a&27b74a78&0&0000#{4d1e55b2-f16f-11cf-88cb-001111000030} (GUID_DEVINTERFACE_HID)
Kernel Name              : \Device\000000f2
Device ID                : HID\VID_1A86&PID_E008\A&27B74A78&0&0000
Hardware IDs             : HID\VID_1A86&PID_E008&REV_1400 HID\VID_1A86&PID_E008 HID\VID_1A86&UP:FFA0_U:0001 HID_DEVICE_UP:FFA0_U:0001 HID_DEVICE_UPR:FF00-FFFF HID_DEVICE
Driver KeyName           : {745a17a0-74d3-11d0-b6fe-00a0c90f57da}\0019 (GUID_DEVCLASS_HIDCLASS)
Driver Inf               : C:\WINDOWS\inf\input.inf
Legacy BusType           : PNPBus
Class                    : HIDClass
Class GUID               : {745a17a0-74d3-11d0-b6fe-00a0c90f57da} (GUID_DEVCLASS_HIDCLASS)
Enumerator               : HID
Location Info            : -
Address                  : 1
Manufacturer Info        : (Standardsystemgeräte)
Capabilities             : 0xE0 (SilentInstall, RawDeviceOK, SurpriseRemovalOK)
Status                   : 0x0180200A (DN_DRIVER_LOADED, DN_STARTED, DN_DISABLEABLE, DN_NT_ENUMERATOR, DN_NT_DRIVER)
First Install Date       : 2025-09-10 16:11:20
Last Arrival Date        : 2025-09-12 00:23:13
EnhancedPowerMgmtEnabled : 0
Power State              : D0 (supported: D0, D3, wake from D0)

             ++++++++++++++ HID Information +++++++++++++++
Manufacturer             : WCH.CN 
Product                  : USB to Serial
UsagePage                : 0xFFA0 (Vendor Defined)
Usage                    : 0x01 (unk)
